75446/-35.99750021527084/66.8502084771431/Map(Heber Waelchi -> 35)/List(esse, accusamus, quam, repellendus, nostrum)/Monday/false;
2450/-88.88687634204773/177.12724973585262/Map(Khalil Hodkiewicz -> 28, Ms. Lorena Hoeger -> 44, Delta Gerlach -> 18, Ron McLaughlin -> 72, Ottilie Stokes -> 1, Myrl Jaskolski -> 4, Ada Hane -> 87)/List(facilis, in, alias, rerum, aut, officiis, qui, reiciendis, iste, explicabo, eos, aspernatur, est, voluptatibus, libero, accusantium)/Friday/true;
23107/-29.26564555239154/35.67180877145725/Map(Amari Johns -> 49, Lilla Kihn -> 68)/List(quaerat, molestias, vitae, commodi, asperiores, dolores, odio, expedita, sunt, repellendus, omnis, qui, qui, eaque, commodi, saepe, quaerat, corporis)/Sunday/false;
79174/89.85961544071449/-99.33150259066547/Map(Mr. Gavin Marquardt -> 41, Eusebio Bosco -> 14, Nichole Reynolds -> 47, Shad Johnson -> 83, Stephon Graham -> 14)/List(nisi, libero, praesentium, ex, magni)/Saturday/true;
42983/21.745045246014584/-148.11818451875445/Map(Dalton Toy Jr. -> 6, Mollie Stracke -> 45, Brando Brakus -> 89)/List(dignissimos, et, quia, quo, voluptatibus, qui, veniam, rem, ad)/Monday/true;
74649/-89.88147967358351/53.85276703736275/Map(Janick Borer -> 66, Mr. Jedidiah Legros -> 48)/List(quas, libero, maxime, veniam, autem, maxime, fugit)/Tuesday/false;
96871/60.09934650917023/-28.275543310020993/Map()/List(numquam)/Tuesday/false;
12589/84.42531681664659/120.09509814400081/Map(Mr. Jaime Durgan -> 56, Joseph Effertz -> 26, Ines Bartell -> 29, Florian Bechtelar -> 61, Anne Pouros -> 44, Ms. Josianne Koch -> 85, Trisha Gibson -> 74, Missouri Kshlerin -> 61, Miss Andreane Emmerich -> 34)/List(fugit, molestias, nemo, quo, eos, deleniti, quisquam, et, molestiae, magnam, sint, iure, omnis, eaque, accusamus)/Monday/true;
54862/64.65788248806743/80.21458811469125/Map(Maida Leannon -> 15, Blanca Fay -> 45, Dr. Coty Kuhn -> 64, Delmer Blick II -> 3, Richard Nader -> 82, Viviane Smitham -> 94, Connor Robel -> 89, Mr. Clair Wisoky -> 33, Bradly Bailey -> 99)/List(dolor, est, sed, illum, quia, iusto, sunt, qui, ipsum, veritatis, quae)/Wednesday/true;
82116/53.176833194459476/154.4444825801316/Map(Halie Gaylord -> 9)/List(necessitatibus, voluptas, molestiae, ea, sint, blanditiis, velit, ut, sed, perferendis, aut, nihil, consequatur)/Tuesday/true;
1304/-22.658996119626323/-65.81954645680455/Map(Magdalen Schimmel -> 91, Ola Jewess -> 0, Mr. Berry Ernser -> 82, Gonzalo Brown -> 34, Jevon Steuber -> 3)/List()/Monday/true;
91466/-32.51814110799589/-127.1987975177407/Map()/List(aut, eum, deleniti, voluptatem, omnis, architecto, et, eaque, sit, est, dolorem, dolore, et, molestiae, non, velit)/Friday/false;
37088/26.66067575009889/176.74224286295816/Map(Malika Stehr -> 49, Ms. Chloe Will -> 84)/List(eius, tempore, quibusdam)/Wednesday/false;
95097/88.7181195474887/141.46529692587342/Map(Ms. Nash Wolf -> 69, Mallie Stark -> 15, Dr. Vivian Rowe -> 39, Paul Douglas -> 21)/List(architecto, qui, consequatur, perspiciatis, quasi, et, dolore, ducimus, commodi, delectus, nesciunt, consequatur, praesentium, distinctio, sed, sit, totam)/Saturday/true;
18888/49.72912084302547/78.65498055554724/Map(Dakota Bauch -> 79, Leila Raynor -> 71, Amaya Wilderman -> 19, Meaghan Johns -> 49, Aaliyah Schmitt -> 10, Jamarcus Hammes -> 40)/List(eos, voluptatem, accusamus, fuga, maiores, et, quasi)/Friday/true;
56268/72.50460703076374/-109.80334052508732/Map(Bernita Jacobi -> 81, Heaven Gottlieb -> 51, Ruben Halvorson -> 86)/List(nihil, rerum, quia, accusantium)/Tuesday/false;
51838/-35.89365206997237/-42.81953024138278/Map(Elvis Vandervort -> 47, John Block -> 20)/List(velit, optio, et, ea, laborum, rerum, repudiandae, perspiciatis, dignissimos, consequatur, autem, qui, quibusdam, excepturi, rerum, est)/Tuesday/true;
66395/62.110836558832034/-73.6200075259972/Map(Fabian Lind -> 30, Logan Price -> 64, Albertha Farrell PhD -> 68, Eladio Bailey -> 13, Guiseppe Bergstrom -> 9, Marty Becker -> 13, Antonietta Frami -> 11)/List(in, vel, ea, reiciendis, a, ut, quam, assumenda, consequatur, animi)/Thursday/true;
49939/86.31364417270018/-176.91239263086075/Map()/List(perspiciatis, consequatur, laudantium, non, consequuntur, dolorem, ratione, quasi, ad, quos)/Sunday/false;
3625/15.007651189868241/-155.20019225865568/Map(Elisa Metz DVM -> 46, Miss Blair Lindgren -> 49, Ebba O'Kon IV -> 65, Jaydon McCullough -> 89, Braulio Langosh -> 64, Nolan Stroman -> 43, Ms. Melisa Dare -> 73, Mollie Nikolaus Jr. -> 33)/List()/Tuesday/false;
98135/53.12934013192745/50.21128403431308/Map(Eldora Hauck -> 92, Clair Considine PhD -> 51, Ruby Rohan -> 65, Miss Zora Reynolds -> 75)/List(omnis, optio)/Tuesday/false;
92224/55.556572925940486/103.90660720757182/Map(Damaris Torphy -> 66, Eusebio Senger I -> 14, Kailey Bruen -> 95, Genoveva Balistreri -> 82, Nova Hane -> 47, Garrick Lynch -> 13, Cortez Hickle Sr. -> 48, Kaylie Pouros -> 39)/List(necessitatibus, totam, voluptas, ea, maxime, est, voluptatem, exercitationem, qui, aliquid, illum, reiciendis, in, qui, itaque)/Friday/true;
19679/34.90295252427629/11.747656573810815/Map(Ibrahim Stehr PhD -> 37, Daniela Bartell -> 87, Dariana Yundt -> 59, Eloise Daniel -> 75, Dr. Brooks Muller -> 87)/List(quo, quia, itaque, quia, quasi, suscipit, optio, nobis, qui, autem, repellendus)/Friday/false;
22761/50.79913277616174/53.26132530681565/Map()/List(voluptatibus, consectetur, quae, animi, nobis, et, repellat)/Tuesday/false;
22494/19.66609195587185/166.13424334154712/Map(Dangelo Mann -> 12)/List(consequuntur, eius, quis, omnis, animi, voluptas, eos, velit, iure, rerum, et, impedit, minus)/Tuesday/true;
48781/-29.0025480837917/162.53110789095052/Map(Odessa Bogisich -> 69, Ruby Quitzon -> 89)/List(atque, eaque, eum, laudantium, praesentium, sit, quo, cum, dicta, voluptatem, eos, omnis, est, excepturi, facilis, facere)/Tuesday/false;
25121/47.185509726830276/101.27645642088515/Map(Erick Lindgren -> 84)/List(accusantium, officia, totam, maiores, illo, alias, dolorem, facilis)/Wednesday/false;
54286/37.12833047120894/-74.46862021298018/Map()/List(voluptate, et, aspernatur, vel, non, eum, quis, et, ut, similique, molestias, eius)/Saturday/false;
